{
 "schema_version": "v1",
 "id": "wo-v2-059",
 "kind": "work-order",
 "created_at": "2026-08-25T01:39:13Z",
 "correlation_id": "v2-059-pause-semantics",
 "problem_brief_ref": "pb-v2-059",
 "design_packet_ref": "dp-v2-059",
 "observable_outcome": "docs/product/definition.md section 7 states the measured pause semantics -- under any mode other than allow no authoritative durable effect is constructed at all, so pause intake and pause claim also deny claim, result acceptance and every outbox effect kind, leaving only checkpoint (and, under pause claim, Requirement intake) -- and the per-mode allowed-cell counts behind that sentence are asserted by TestStopModeByKindMatrix, which the document cites by name. internal/domain is unchanged.",
 "allowed_paths": [
  "docs/product/definition.md",
  "internal/application/stop_matrix_test.go",
  ".agents/v2/evidence/V2-059-docs.json",
  ".agents/v2/evidence/V2-059-application.json",
  ".agents/v2/evidence/index.json"
 ],
 "prohibited_paths": [
  "ci/components.json",
  "ci/**",
  "Makefile",
  "go.mod",
  "go.sum",
  "devbox.json",
  "devbox.lock",
  ".agents/v2/task-state/**",
  ".agents/v2/packets/**",
  "internal/domain/**",
  "internal/application/service.go",
  "internal/application/outbox.go",
  "internal/application/ports.go",
  "internal/application/readmodels.go",
  "internal/store/**",
  "internal/reconciler/**",
  "internal/runner/**",
  "internal/api/**",
  "internal/release/**",
  "internal/provider/**",
  "internal/scheduler/**",
  "internal/contracts/**",
  "contracts/**",
  "cmd/**",
  "infra/**",
  "scripts/**",
  ".github/**",
  "docs/product/user-facing-spec.md",
  "docs/architecture/**",
  "docs/operations/**",
  "docs/preview/**",
  "README.md",
  "AGENTS.md"
 ],
 "contracts_changed": [],
 "acceptance_criteria": [
  "A1. Measure first, and do not trust prior prose. Assert the per-mode allowed-cell counts yourself. The expected values are allow=8, pause-intake=1 (checkpoint only), pause-claim=2 (Requirement intake and checkpoint), graceful-stop=1 (checkpoint only), immediate-stop=0, emergency-stop=0, cancel=0, total 12 of 56. Note that V2-019's a12 evidence summary records pause-intake=2/8 (capture, checkpoint) and a total of 13/56; that prose is wrong because the matrix drives Capture as domain.PermitIntake and pause-intake denies exactly PermitIntake. If your measurement disagrees with the expected values above, stop and escalate rather than adjusting either the numbers or the document to fit.",
  "A2. Anchor the claim in the test. In internal/application/stop_matrix_test.go add, inside TestStopModeByKindMatrix, a per-mode allowed-cell count assertion against a named table declaring the seven expected counts and their total, so the documented sentence has a test that breaks if the gate changes. Keep the top-level test name, the existing wantStopMatrixCells total assertion and the existing graceful-stop-allows-only-checkpoint assertion exactly as they are. Add nothing that requires internal/domain to change and nothing that re-derives the M1 closure proof.",
  "A3. Rewrite the two pause bullets in docs/product/definition.md section 7 (currently at lines 142 and 143) verbatim as follows. Replace \"- **pause intake**: 新しいRequirementの受付またはqueue投入を止める\" with \"- **pause intake**: 新しいRequirementの受付またはqueue投入を止める。allow以外のmodeであるため、実行中の仕事に残る操作はcheckpointの保存だけになる\". Replace \"- **pause claim**: 新しい仕事のclaimを止め、実行中の仕事は定義済みの境界まで進める\" with \"- **pause claim**: 新しい仕事のclaimを止める。実行中の仕事が進める「定義済みの境界」はcheckpointであり、結果の受理や外部副作用の確定はできない\". Change no other bullet in that list.",
  "A4. Insert one new paragraph immediately after the seven-item control list in section 7, before the existing paragraph beginning \"停止commandの受付だけを成功とみなさない\", with exactly this content (line-wrapped to match the surrounding paragraphs' width; wording unchanged): \"pauseはmode名が示す入口だけを閉じる制御ではない。allow以外のどのmodeでも、durableな副作用を伴うauthoritative effectは一切構成されない（effectの唯一の構成経路が、current effective modeがallowであることを要求する）。したがってpause intake／pause claimの下でも、claim、実行結果の受理、outboxのintegration／promotion／preview-deploy／external-effectはすべて拒否される。実測は7 mode×8 kind＝56 cellのmatrixで確認しており、許可されるcellはallow=8、pause-claim=2（Requirement受付とcheckpoint）、pause-intake=1（checkpointのみ）、graceful-stop=1（checkpointのみ）、immediate stop／emergency stop／cancel=0、合計12である。この閉包はM1 gateがinvariant 2として証明した設計であり、pauseを「新規受付だけを止める弱い制御」と読むことはできない。\" Then append to that paragraph one sentence naming the anchoring test, of the form: このcell数はinternal/applicationのTestStopModeByKindMatrixが検証している。",
  "A5. Do not weaken or reinterpret the invariant. The document must say that pause stops strictly more than its name suggests, never less, and must not describe the closure as a limitation to be lifted. internal/domain is not edited and no test asserting the closure is relaxed.",
  "A6. Confirm the scope decision by measurement, without editing. Record that docs/product/user-facing-spec.md section 4.8 and docs/architecture/domain-model.md were read and state nothing the measurement contradicts (4.8 lists which controls a user can issue, not what each one leaves running; domain-model.md lists the modes and their precedence). If either is found to make a claim the measurement contradicts, stop and escalate instead of editing it under this Work Order.",
  "A7. Existing tests. Every pre-existing test in internal/application still passes under its existing name with its assertions unchanged. Report the before and after top-level test counts.",
  "A8. devbox run --pure -- make component-docs and devbox run --pure -- make component-application are both green, and devbox run --pure -- go test -count=1 -v -run TestStopModeByKindMatrix ./internal/application is run and its output recorded.",
  "A9. Evidence. Create two artifacts: .agents/v2/evidence/V2-059-docs.json (id ev-v2-059-docs, component docs) and .agents/v2/evidence/V2-059-application.json (id ev-v2-059-application, component application), both task_id V2-059, correlation_id v2-059-pause-semantics. Each records for every check the argv actually executed, the working directory, the timeout, and a summary stating the measured result; the docs record must quote the before and after text of both bullets and the inserted paragraph, and the application record must state the measured per-mode counts. A skipped test is never counted as a pass (gate rule G7). Record the execution environment identifier (uname -srm, go version, devbox environment). Register both with exactly two appended entries in .agents/v2/evidence/index.json whose evidence_hash values are the sha256 of each artifact's final committed bytes; touch no other task's entry. devbox run --pure -- go test -count=1 ./internal/contracts must be green with both records in place.",
  "A10. Each record's evidence_key is its own component key (docs, application) read with devbox run --pure -- make evidence-keys on the final tree where make check is green, with every touched file already git-added -- a new file not yet added to the index is invisible to that key.",
  "A11. devbox run --pure -- make check is green, and it is re-run after the evidence commit so the secret scan reads committed history rather than an uncommitted tree. Record both runs.",
  "A12. Record a note that V2-019's a12 evidence summary carries the wrong pause-intake count, without editing that record: it belongs to another task and is resolved by whoever next refreshes it. State the corrected counts in this task's evidence so the wrong prose cannot be cited again.",
  "A13. No file outside allowed_paths changes. ci/components.json, Makefile, go.mod, go.sum and devbox.* are untouched."
 ],
 "validation": {
  "argv": [
   "devbox",
   "run",
   "--pure",
   "--",
   "make",
   "check"
  ],
  "working_directory": ".",
  "timeout_seconds": 2400
 },
 "constraints": [
  "Work only inside the assigned isolated task worktree; never push.",
  "Never use git reset, git checkout --, git stash or git commit --amend.",
  "Do not touch ci/components.json, Makefile, go.mod, go.sum or devbox.*; the component dependency DAG and the toolchain surface are V2-045's task.",
  "Do not touch .agents/v2/task-state/** or .agents/v2/packets/**; the coordinator records transitions and packets.",
  "Determinism is acceptance, not preference: no fixed sleep, no wall-clock timer, no goroutine in any new test. Waiting is expressed only as bounded deadline polling with an injected clock, and a measured duration is logged as an observation, never asserted as a threshold.",
  "A skipped test is never counted as a pass (gate rule G7). Record every skip explicitly with its status \"skipped\" and its reason.",
  "Record the execution environment identifier (uname -srm, go version, devbox environment) in the evidence.",
  "Never write a verification as passed that was not actually executed. If an acceptance item cannot be satisfied, stop and escalate to the tech_lead rather than fabricating or weakening it.",
  "Do not start a real Provider CLI (codex/claude/opencode) and do not touch any Google Cloud resource.",
  "Every pre-existing test must keep passing under its existing name. Report the before and after top-level test counts per touched package.",
  "Do not edit internal/domain. Relaxing the L3 closure so that pause-intake or pause-claim would permit an effect is prohibited: it would weaken the closure the M1 gate proved as invariant 2.",
  "Do not change internal/application/service.go or outbox.go; this task changes a document and adds one assertion to an existing test.",
  "Do not copy the per-mode counts from V2-019's evidence prose; measure them.",
  "Do not edit any document other than docs/product/definition.md."
 ],
 "failure_stop": true,
 "tasks": [
  "V2-059"
 ],
 "priority": 60
}
